{
  "$schema": "https://json-schema.org/draft/2020-12/schema",
  "$id": "https://spectrum-systems.org/contracts/sl_final_fixes_produce_durable_traps_record.schema.json",
  "title": "sl_final_fixes_produce_durable_traps_record",
  "type": "object",
  "required": [
    "artifact_type",
    "artifact_id",
    "artifact_version",
    "schema_version",
    "standards_version",
    "created_at",
    "status",
    "reason_codes"
  ],
  "properties": {
    "artifact_type": {
      "const": "sl_final_fixes_produce_durable_traps_record"
    },
    "artifact_id": {
      "type": "string",
      "minLength": 1
    },
    "artifact_version": {
      "type": "string",
      "pattern": "^\\d+\\.\\d+\\.\\d+$"
    },
    "schema_version": {
      "type": "string",
      "const": "1.0.0"
    },
    "standards_version": {
      "type": "string",
      "pattern": "^\\d+\\.\\d+\\.\\d+$"
    },
    "created_at": {
      "type": "string",
      "format": "date-time"
    },
    "status": {
      "type": "string",
      "enum": [
        "pass",
        "fail",
        "block"
      ]
    },
    "reason_codes": {
      "type": "array",
      "items": {
        "type": "string"
      },
      "minItems": 1
    }
  },
  "additionalProperties": true
}
