{
  "artifact_type": "sl_final_fixes_produce_durable_traps_record",
  "artifact_id": "sl_final_fixes_produce_durable_traps_record-example-001",
  "artifact_version": "1.0.0",
  "schema_version": "1.0.0",
  "standards_version": "1.9.6",
  "created_at": "2026-04-17T00:00:00Z",
  "status": "pass",
  "reason_codes": [
    "ok"
  ]
}
